Timestamp,Respondent ID,Topic,Question Text,Fluency,Relevance,Usefulness
4/27/2026 16:02:06,R1777296599077351,Porterville,What is Porterville known for in terms of its economy or industry?,5,3,3
4/27/2026 16:02:06,R1777296599077351,Porterville,Is Porterville a city in California?,5,4,3
4/27/2026 16:02:07,R1777296599077351,Porterville,"Is Porterville a specific city or location you're referring to, such as in California?",5,4,3
4/27/2026 16:02:07,R1777296599077351,Porterville,What is the intended meaning of porterville?,5,1,5
4/27/2026 16:02:08,R1777296599077351,Porterville,What is Porterville's primary economic industry?,5,2,4
4/27/2026 16:02:08,R1777296599077351,Rick Warren,Is Rick Warren's focus on spiritual growth and leadership primarily geared towards Christians or also applicable to other faiths?,5,5,3
4/27/2026 16:02:08,R1777296599077351,Rick Warren,What is the intended meaning of rick warren?,3,1,2
4/27/2026 16:02:09,R1777296599077351,Rick Warren,Is Rick Warren a Christian author?,5,3,3
4/27/2026 16:02:09,R1777296599077351,Rick Warren,Who is Rick Warren's primary audience for his books and sermons?,5,4,4
4/27/2026 16:02:09,R1777296599077351,Adobe Indian Houses,Are Adobe Indian houses typically found in dry desert regions?,5,2,3
4/27/2026 16:02:10,R1777296599077351,Adobe Indian Houses,"Who were the Adobe Indian people, and what was their traditional way of life?",5,4,4
4/27/2026 16:02:10,R1777296599077351,Adobe Indian Houses,What type of traditional Indian houses are commonly associated with Adobe construction?,5,3,3
4/27/2026 16:02:10,R1777296599077351,Adobe Indian Houses,What role did traditional Indian houses play in the daily lives of their occupants?,5,4,3
4/27/2026 16:02:10,R1777296599077351,Adobe Indian Houses,"What specific type of Adobe Indian house are you referring to, such as a Pueblo or Anasazi dwelling?",5,5,3
4/27/2026 16:02:11,R1777296599077351,Indexed Annuity,Is an indexed annuity tied to a specific inflation index?,5,4,4
4/27/2026 16:02:11,R1777296599077351,Indexed Annuity,What is the intended meaning of indexed annuity?,5,3,5
4/27/2026 16:02:11,R1777296599077351,Indexed Annuity,"Is an indexed annuity specifically tied to a particular market index, such as the S&P 500?",5,3,3
4/27/2026 16:02:11,R1777296599077351,Indexed Annuity,What is the primary benefit of investing in an indexed annuity?,5,4,3
4/27/2026 16:02:11,R1777296599077351,Bellevue,Is Bellevue referring to the city in Washington state or another location?,5,5,2
4/27/2026 16:02:11,R1777296599077351,Bellevue,Is Bellevue a specific city or location?,5,3,4
4/27/2026 16:02:11,R1777296599077351,Bellevue,What is the intended meaning of bellevue?,5,2,2
4/27/2026 16:02:12,R1777296599077351,Bellevue,Is Bellevue a city?,5,4,4
4/27/2026 16:02:13,R1777296599077351,Bellevue,What is the context in which Bellevue refers to?,5,5,5
4/27/2026 16:02:13,R1777296599077351,Elliptical Trainer,What is the intended meaning of elliptical trainer?,5,3,4
4/27/2026 16:02:13,R1777296599077351,Elliptical Trainer,What is the typical target area of an elliptical trainer for users with joint issues?,5,4,4
4/27/2026 16:02:13,R1777296599077351,Elliptical Trainer,What is the intended purpose of an elliptical trainer?,5,2,5
4/27/2026 16:02:13,R1777296599077351,Elliptical Trainer,"Is there a specific type of elliptical trainer (e.g. home gym, commercial use, budget range) you are looking for more information on?",5,4,3
4/27/2026 16:02:13,R1777296599077351,Elliptical Trainer,Is an elliptical trainer a type of cardio machine?,5,2,2
4/27/2026 16:02:14,R1777296599077351,Alexian Brothers Hospital,Is Alexian Brothers Hospital a real medical facility?,5,4,5
4/27/2026 16:02:15,R1777296599077351,Alexian Brothers Hospital,What notable medical innovation did Alexian Brothers Hospital develop?,5,3,3
4/27/2026 16:02:15,R1777296599077351,Alexian Brothers Hospital,What is the role of Alexian Brothers Hospital in providing healthcare services to the community?,5,3,4
4/27/2026 16:02:17,R1777296599077351,Alexian Brothers Hospital,What is the primary role or function of Alexian Brothers Hospital in serving its community?,5,4,3
4/27/2026 16:02:17,R1777296599077351,Alexian Brothers Hospital,"Is Alexian Brothers Hospital located in Peoria, Illinois?",5,5,4
4/27/2026 16:02:17,R1777296599077351,Dutchess County Tourism,Is Dutchess County a popular tourist destination?,5,5,2
4/27/2026 16:02:17,R1777296599077351,Dutchess County Tourism,What seasonal events are typically held in Dutchess County?,5,4,4
4/27/2026 16:02:18,R1777296599077351,Dutchess County Tourism,"What is the primary target audience for Dutchess County Tourism, and how do they differ from other regional tourist groups?",5,2,4
4/27/2026 16:02:18,R1777296599077351,Dutchess County Tourism,What nearby attractions are there in Dutchess County that complement its historic sites and natural beauty?,5,4,5
4/27/2026 16:02:18,R1777296599077351,Dutchess County Tourism,Is Dutchess County in New York State?,5,2,2
4/27/2026 16:02:20,R1777296599077351,California Franchise Tax Board,Is the California Franchise Tax Board responsible for collecting taxes on businesses operating in California?,5,3,3
4/27/2026 16:02:20,R1777296599077351,California Franchise Tax Board,"Is the California Franchise Tax Board (FTB) primarily responsible for taxing businesses operating in California, or are there specific industries or types of businesses that may be subject to different tax regulations?",5,5,4
4/27/2026 16:02:21,R1777296599077351,California Franchise Tax Board,What is the name of the California state agency responsible for administering the franchise tax?,5,2,3
4/27/2026 16:02:22,R1777296599077351,California Franchise Tax Board,What is the primary role of the California Franchise Tax Board in relation to businesses operating within the state?,5,4,4
4/27/2026 16:02:22,R1777296599077351,California Franchise Tax Board,What role does the California Franchise Tax Board play in enforcing tax laws for businesses operating within the state?,5,4,5
4/27/2026 16:02:22,R1777296599077351,To Be Or Not To Be That Is The Question,"Is this a philosophical inquiry about existentialism, specifically referencing Shakespeare's Hamlet?",5,4,3
4/27/2026 16:02:23,R1777296599077351,To Be Or Not To Be That Is The Question,Is this a philosophical inquiry?,5,3,2
4/27/2026 16:02:23,R1777296599077351,To Be Or Not To Be That Is The Question,"What philosophical framework is Hamlet's famous soliloquy ""To be or not to be"" primarily rooted in?",5,4,4
4/27/2026 16:02:23,R1777296599077351,To Be Or Not To Be That Is The Question,Is Hamlet the author of this famous philosophical query?,5,3,3
4/27/2026 16:02:23,R1777296599077351,To Be Or Not To Be That Is The Question,"What is the context in which Shakespeare's famous phrase ""to be or not to be"" appears?",5,5,4
4/27/2026 16:02:24,R1777296599077351,Texas Border Patrol,"What specific aspect of Texas Border Patrol are you looking for information on, such as their operations, policies, or statistics?",5,5,4
4/27/2026 16:02:26,R1777296599077351,Texas Border Patrol,Is Texas a U.S. state?,5,1,2
4/27/2026 16:02:26,R1777296599077351,Texas Border Patrol,Who is responsible for overseeing the operations of the Texas Border Patrol?,5,4,2
4/27/2026 16:02:26,R1777296599077351,Texas Border Patrol,What notable contributions has the Texas Border Patrol made to border security efforts?,5,4,2
4/27/2026 16:02:26,R1777296599077351,Texas Border Patrol,What role does Texas Border Patrol play in enforcing immigration laws?,5,3,5
4/27/2026 16:02:27,R1777296599077351,Hp Mini 2140,What is the processor speed of the HP Mini 2140?,5,4,5
4/27/2026 16:02:27,R1777296599077351,Hp Mini 2140,What is the intended meaning of hp mini 2140?,5,1,1
4/27/2026 16:02:27,R1777296599077351,Hp Mini 2140,Is the HP Mini 2140 a discontinued model?,5,3,5
4/27/2026 16:02:28,R1777296599077351,Hp Mini 2140,What is the typical price range for a refurbished HP Mini 2140 laptop?,5,4,3
4/27/2026 16:02:28,R1777296599077351,Hp Mini 2140,Is the HP Mini 2140 a specific model year or generation that you're looking for information on?,5,5,3
4/27/2026 16:02:28,R1777296599077351,Espn Sports,"Is ESPN referring to a specific sport or league, such as NFL, NBA, MLB, or NHL?",5,3,3
4/27/2026 16:02:28,R1777296599077351,Espn Sports,What is the intended meaning of espn sports?,5,1,4
4/27/2026 16:02:28,R1777296599077351,Espn Sports,Is ESPN primarily a sports network?,5,4,4
4/27/2026 16:02:29,R1777296599077351,Espn Sports,What is the primary role of ESPN in the sports media landscape?,5,3,4
4/27/2026 16:02:29,R1777296599077351,Espn Sports,What is the current context of ESPN's sports coverage?,5,2,2
4/27/2026 16:02:30,R1777296599077351,Tn Highway Patrol,What role does the Tennessee Highway Patrol play in enforcing traffic laws?,5,4,3
4/27/2026 16:02:30,R1777296599077351,Tn Highway Patrol,Who is responsible for enforcing traffic laws along Tennessee highways?,5,3,2
4/27/2026 16:02:30,R1777296599077351,Tn Highway Patrol,"Is there a specific Tennessee Highway Patrol (THP) unit or division you are referring to, such as the THP's traffic enforcement efforts?",5,5,5
4/27/2026 16:02:30,R1777296599077351,Tn Highway Patrol,Is the Tennessee Highway Patrol a law enforcement agency?,5,3,2
4/27/2026 16:02:31,R1777296599077351,Tn Highway Patrol,What notable contributions has the Tennessee Highway Patrol made to highway safety?,5,2,2
4/27/2026 16:02:31,R1777296599077351,East Ridge High School,What is the current student body of East Ridge High School?,5,3,3
4/27/2026 16:02:31,R1777296599077351,East Ridge High School,Is East Ridge High School a public school?,5,4,2
4/27/2026 16:02:31,R1777296599077351,East Ridge High School,What is the main purpose or type of East Ridge High School?,2,3,3
4/27/2026 16:02:31,R1777296599077351,East Ridge High School,Is East Ridge High School located in Tennessee?,5,4,3
4/27/2026 16:02:32,R1777296599077351,East Ridge High School,What is the location of East Ridge High School?,5,5,5
4/27/2026 16:02:32,R1777296599077351,Atari,What is the intended meaning of atari?,5,2,2
4/27/2026 16:02:32,R1777296599077351,Atari,What was the historical context in which the Atari company emerged?,5,4,4
4/27/2026 16:02:32,R1777296599077351,Atari,What is the primary purpose of the Atari brand?,5,3,1
4/27/2026 16:02:32,R1777296599077351,Atari,Is Atari a well-known video game company?,5,5,4
4/27/2026 16:02:32,R1777296599077351,Atari,Was Atari specifically referring to the classic arcade console or the video game company that developed it?,5,4,4
4/27/2026 16:02:33,R1777296599077351,Ralph Owen Brewster,What notable scientific contribution did Ralph Owen Brewster make?,5,3,4
4/27/2026 16:02:33,R1777296599077351,Ralph Owen Brewster,Who was Ralph Owen Brewster?,5,5,3
4/27/2026 16:02:33,R1777296599077351,Ralph Owen Brewster,Is Ralph Owen Brewster a real person?,5,3,4
4/27/2026 16:02:33,R1777296599077351,Ralph Owen Brewster,What was Ralph Owen Brewster's profession?,5,1,2
4/27/2026 16:02:33,R1777296599077351,Ralph Owen Brewster,Was Ralph Owen Brewster an American inventor or engineer?,5,4,2
4/27/2026 16:02:34,R1777296599077351,Avp,What is AvP in the context of video games?,5,5,5
4/27/2026 16:02:34,R1777296599077351,Avp,Is AvP a movie?,5,4,3
4/27/2026 16:02:34,R1777296599077351,Avp,"What is the context in which the term ""avp"" is typically used?",5,3,3
4/27/2026 16:02:35,R1777296599077351,Avp,What is the intended meaning of avp?,5,1,3
4/27/2026 16:02:35,R1777296599077351,Avp,"Is the query referring to the 1997 film ""Alien vs. Predator"" or perhaps a different context, such as a video game series?",5,4,4
4/27/2026 16:02:35,R1777296599077351,Best Long Term Care Insurance,"What are the specific features or benefits that you're looking for in a long-term care insurance policy, such as coverage limits, deductibles, or riders?",5,5,5
4/27/2026 16:02:35,R1777296599077351,Best Long Term Care Insurance,Who is typically most affected by the high costs of long-term care insurance?,5,3,2
4/27/2026 16:02:35,R1777296599077351,Best Long Term Care Insurance,What type of long-term care insurance plan is best suited for individuals with chronic health conditions?,5,4,3
4/27/2026 16:02:36,R1777296599077351,Best Long Term Care Insurance,Is long-term care insurance typically more expensive for younger individuals?,5,4,2
4/27/2026 16:02:36,R1777296599077351,Volvo,What is the intended meaning of volvo?,5,1,1
4/27/2026 16:02:36,R1777296599077351,Volvo,"Is it referring to the Swedish automobile manufacturer or another entity with the name ""Volvo""?",5,3,4
4/27/2026 16:02:36,R1777296599077351,Volvo,Is Volvo a car brand?,5,3,4
4/27/2026 16:02:38,R1777296599077351,Volvo,Who is Volvo's primary target audience for its vehicles?,5,2,5
4/27/2026 16:02:38,R1777296599077351,Volvo,What is the context in which Volvo is typically associated?,5,5,3
4/27/2026 16:02:38,R1777296599077351,Korean Language,What is the intended meaning of korean language?,4,1,1
4/27/2026 16:02:38,R1777296599077351,Korean Language,Is Korean a tonal language?,5,4,2
4/27/2026 16:02:39,R1777296599077351,Korean Language,Is there a specific dialect or regional variation of Korean you would like to know more about?,5,5,4
4/27/2026 16:02:39,R1777296599077351,Korean Language,What is the cultural context in which the Korean language originated?,5,4,3
4/27/2026 16:02:40,R1777296599077351,Korean Language,Is Korean a native language of South Korea?,5,2,5
4/27/2026 16:02:40,R1777296599077351,Figs,Are figs typically eaten fresh?,5,4,3
4/27/2026 16:02:41,R1777296599077351,Figs,"Are you referring to the fruit, its nutritional benefits, or perhaps a specific variety of fig?",5,5,5
4/27/2026 16:02:41,R1777296599077351,Figs,What are some common health benefits associated with consuming figs?,5,4,5
4/27/2026 16:02:42,R1777296599077351,Figs,What type of figs are you looking for?,5,3,3
4/27/2026 16:02:42,R1777296599077351,Figs,What is the intended meaning of figs?,5,1,1
4/27/2026 16:02:42,R1777296599077351,Ocd,What is the intended meaning of ocd?,5,5,4
4/27/2026 16:02:42,R1777296599077351,Ocd,Is OCD typically considered a mental health disorder?,5,4,4
4/27/2026 16:02:42,R1777296599077351,Ocd,What is OCD typically characterized by in terms of its symptoms?,5,4,4
4/27/2026 16:02:44,R1777296599077351,Ocd,Is OCD typically associated with any specific age group or demographic?,5,4,4
4/27/2026 16:02:44,R1777296599077351,Ocd,What is the typical context in which obsessive-compulsive disorder (OCD) is typically diagnosed or discussed?,5,4,3
4/27/2026 16:02:44,R1777296599077351,Computer Programming,What is the primary role of a compiler in the process of writing code?,5,4,3
4/27/2026 16:02:44,R1777296599077351,Computer Programming,Is computer programming a required skill for most jobs?,5,3,5
4/27/2026 16:02:44,R1777296599077351,Computer Programming,"Is there a specific area of computer programming (e.g. web development, machine learning, game development) that you would like more information on?",5,5,5
4/27/2026 16:02:44,R1777296599077351,Computer Programming,What is the primary context in which computer programming is typically applied?,5,4,3
4/27/2026 16:02:44,R1777296599077351,Computer Programming,What is the intended meaning of computer programming?,5,1,2
4/27/2026 16:02:45,R1777296599077351,Furniture For Small Spaces,"What specific type of furniture are you looking to purchase for your small space, such as compact sofas or foldable tables?",5,5,5
4/27/2026 16:02:45,R1777296599077351,Furniture For Small Spaces,"What type of furniture is most suitable for individuals with limited mobility, such as those in small spaces?",5,4,5
4/27/2026 16:02:45,R1777296599077351,Furniture For Small Spaces,What type of furniture is best suited for small spaces?,5,4,4
4/27/2026 16:02:46,R1777296599077351,Furniture For Small Spaces,Is budget a consideration when selecting furniture for small spaces?,5,4,2
4/27/2026 16:02:46,R1777296599077351,Furniture For Small Spaces,What types of furniture are best suited for narrow hallways or staircases in small apartments?,5,3,3
4/27/2026 16:02:46,R1777296599077351,Starbucks,What is the typical context in which Starbucks operates?,5,3,2
4/27/2026 16:02:47,R1777296599077351,Starbucks,What is the intended meaning of starbucks?,5,1,1
4/27/2026 16:02:47,R1777296599077351,Starbucks,"Who is Howard Schultz, the former CEO of Starbucks?",5,3,3
4/27/2026 16:02:48,R1777296599077351,Starbucks,Is Starbucks a coffee shop?,5,5,5
4/27/2026 16:02:48,R1777296599077351,Starbucks,Is Starbucks referring to the specific coffee shop chain or is it also related to the celestial body?,5,4,4
4/27/2026 16:02:49,R1777296599077351,Vldl Levels,What are the typical contexts in which VLDL levels are measured?,5,4,4
4/27/2026 16:02:49,R1777296599077351,Vldl Levels,"What specific type of LDL cholesterol levels are you referring to (e.g., total, HDL, LDL particle count)?",5,5,5
4/27/2026 16:02:50,R1777296599077351,Vldl Levels,Is LDL cholesterol a component of VLDL?,5,3,4
4/27/2026 16:02:50,R1777296599077351,Vldl Levels,What are the typical VLDL levels considered normal or healthy in adults?,5,4,4
4/27/2026 16:02:50,R1777296599077351,Vldl Levels,What is the intended meaning of vldl levels?,5,2,4
4/27/2026 16:02:51,R1777296599077351,Euclid,Who is Euclid in the context of mathematics?,5,3,5
4/27/2026 16:02:51,R1777296599077351,Euclid,What is the intended meaning of euclid?,5,3,2
4/27/2026 16:02:51,R1777296599077351,Euclid,Is Euclid a Greek mathematician?,5,3,3
4/27/2026 16:02:51,R1777296599077351,Euclid,What is the historical context in which Euclid's works were written?,5,5,5
4/27/2026 16:02:51,R1777296599077351,Euclid,Was Euclid referring to the ancient Greek mathematician or the mathematical concept of Euclidean geometry?,5,4,5
4/27/2026 16:02:51,R1777296599077351,Dieting,What is the primary goal of most people who engage in dieting?,5,4,5
4/27/2026 16:02:51,R1777296599077351,Dieting,What specific health concern or goal are you trying to address through dieting?,5,5,5
4/27/2026 16:02:52,R1777296599077351,Dieting,Is dieting typically associated with weight loss?,5,3,3
4/27/2026 16:02:52,R1777296599077351,Dieting,"What specific aspect of dieting are you looking to learn more about, such as weight loss strategies or nutrition plans?",5,4,3
4/27/2026 16:02:52,R1777296599077351,Dieting,What is the intended meaning of dieting?,5,2,2
4/27/2026 16:02:52,R1777296599077351,Dnr,What specific medical condition requires a Do Not Resuscitate order?,5,4,3
4/27/2026 16:02:52,R1777296599077351,Dnr,Is DNR an abbreviation for a specific medical condition or is it related to a particular industry or context?,5,3,4
4/27/2026 16:02:52,R1777296599077351,Dnr,What is the intended meaning of dnr?,5,3,4
4/27/2026 16:02:53,R1777296599077351,Dnr,Do you have any information about the meaning of DNR in medical contexts?,5,4,1
4/27/2026 16:02:53,R1777296599077351,Dnr,Is a DNR order typically made by a patient?,5,5,2
4/27/2026 16:02:53,R1777296599077351,Battles In The Civil War,What were the primary causes of the battles fought during the American Civil War?,5,4,4
4/27/2026 16:02:54,R1777296599077351,Battles In The Civil War,Were there any naval battles during the American Civil War?,5,3,3
4/27/2026 16:02:54,R1777296599077351,Battles In The Civil War,What were some of the most significant battles fought during the American Civil War?,5,5,5
4/27/2026 16:02:56,R1777296599077351,Battles In The Civil War,Was the American Civil War primarily fought between the Union (the Northern states) and the Confederacy (the Southern states)?,5,4,4
4/27/2026 16:02:57,R1777296599077351,Website Design Hosting,What is the role of identity in website design hosting?,5,3,3
4/27/2026 16:02:57,R1777296599077351,Website Design Hosting,"Is there a specific type of website (e.g., e-commerce, blog, portfolio) that you are looking to host?",5,4,5
4/27/2026 16:02:57,R1777296599077351,Website Design Hosting,What types of websites can be effectively hosted on shared or dedicated servers?,5,5,4
4/27/2026 16:02:57,R1777296599077351,Website Design Hosting,What role in website design hosting typically requires expertise in both front-end development and back-end server management?,5,4,2
4/27/2026 16:02:57,R1777296599077351,Website Design Hosting,Is the query related to a specific type of hosting service?,5,4,4
4/27/2026 16:02:57,R1777296599077351,Rock Art,Is rock art typically created for aesthetic purposes?,5,3,3
4/27/2026 16:02:58,R1777296599077351,Rock Art,"Is the specific type of rock art being referred to, such as petroglyphs or pictographs?",5,3,3
4/27/2026 16:02:58,R1777296599077351,Rock Art,Who created the earliest known examples of rock art?,5,5,3
4/27/2026 16:02:58,R1777296599077351,Rock Art,What is the intended meaning of rock art?,5,2,5
4/27/2026 16:02:58,R1777296599077351,Sit And Reach Test,Is the sit and reach test used to assess flexibility?,5,3,4
4/27/2026 16:02:58,R1777296599077351,Sit And Reach Test,What is the purpose of the sit and reach test in relation to identifying individuals with musculoskeletal disorders?,5,4,3
4/27/2026 16:02:58,R1777296599077351,Sit And Reach Test,"What specific aspect of the sit and reach test is being measured, such as flexibility or range of motion?",5,5,3
4/27/2026 16:02:59,R1777296599077351,Sit And Reach Test,What is the primary purpose of the sit and reach test in physical therapy or occupational assessment?,5,5,3
4/27/2026 16:02:59,R1777296599077351,The Wall,Is the wall a physical structure?,5,4,4
4/27/2026 16:02:59,R1777296599077351,The Wall,"Is ""the wall"" referring to a specific physical structure, such as a building or a barrier, rather than an abstract concept?",5,4,5
4/27/2026 16:02:59,R1777296599077351,The Wall,What is the purpose of a typical wall in a building?,5,5,3
4/27/2026 16:03:00,R1777296599077351,The Wall,What is the intended meaning of the wall?,5,1,2
4/27/2026 16:03:00,R1777296599077351,The Wall,"What is the specific need that ""the wall"" refers to?",5,4,2
4/27/2026 16:03:00,R1777296599077351,Vanuatu,Is Vanuatu an independent country or a former French colony?,5,4,3
4/27/2026 16:03:01,R1777296599077351,Vanuatu,Is Vanuatu a country?,5,5,3
4/27/2026 16:03:01,R1777296599077351,Vanuatu,What is the geographical location of Vanuatu?,5,5,4
4/27/2026 16:03:01,R1777296599077351,Vanuatu,What is the intended meaning of vanuatu?,5,2,2
4/27/2026 16:03:01,R1777296599077351,Vanuatu,Is Vanuatu a country or an island nation?,5,3,4
4/27/2026 16:03:02,R1777296599077351,Kiwi,What is the specific nutritional need that kiwi fruit is commonly used to support?,5,4,5
4/27/2026 16:03:02,R1777296599077351,Kiwi,What is the intended meaning of kiwi?,5,2,1
4/27/2026 16:03:02,R1777296599077351,Kiwi,Is the kiwi a type of fruit or a specific variety?,5,5,4
4/27/2026 16:03:03,R1777296599077351,Kiwi,"Is the specific type of kiwi being referred to (e.g. Hayward, Golden, Chinese)?",5,4,5
4/27/2026 16:03:03,R1777296599077351,Kiwi,Is kiwi a type of fruit?,5,4,1
4/27/2026 16:03:03,R1777296599077351,Dangers Of Asbestos,What is the current average cost per ton of asbestos for demolition and removal projects?,5,4,4
4/27/2026 16:03:03,R1777296599077351,Dangers Of Asbestos,Is asbestos still used in many industries today?,5,5,4
4/27/2026 16:03:04,R1777296599077351,Dangers Of Asbestos,What types of asbestos are most commonly associated with health risks?,5,4,5
4/27/2026 16:03:04,R1777296599077351,Dangers Of Asbestos,What specific type of asbestos exposure or situation would you like to know more about?,5,4,5
4/27/2026 16:03:04,R1777296599077351,Dangers Of Asbestos,What specific health effects can asbestos cause in humans?,5,3,4
4/27/2026 16:03:04,R1777296599077351,Iron,"Is the specific type of iron (e.g., steel, cast iron, wrought iron) being referred to?",5,4,3
4/27/2026 16:03:04,R1777296599077351,Iron,Is iron a metal?,5,3,2
4/27/2026 16:03:04,R1777296599077351,Iron,What is the primary role of iron in the human body?,5,5,4
4/27/2026 16:03:04,R1777296599077351,Iron,What context is being referred to when discussing iron?,5,4,4
4/27/2026 16:03:04,R1777296599077351,Iron,What is the intended meaning of iron?,5,1,4
4/27/2026 16:03:05,R1777296599077351,The Secret Garden,Who is Mary Lennox in the story of The Secret Garden?,5,3,3
4/27/2026 16:03:06,R1777296599077351,The Secret Garden,"What is the identity of the main character in ""The Secret Garden""?",5,4,3
4/27/2026 16:03:07,R1777296599077351,The Secret Garden,"What role did Frances Hodgson Burnett play in adapting her novel ""The Secret Garden"" into a stage play?",5,5,2
4/27/2026 16:03:07,R1777296599077351,The Secret Garden,Is the Secret Garden a fictional work?,5,4,4
4/27/2026 16:03:07,R1777296599077351,The Secret Garden,"Was the Secret Garden by Frances Hodgson Burnett set in Yorkshire, England?",5,4,4
4/27/2026 16:03:08,R1777296599077351,Indiana Child Support,What is the name of the Indiana agency responsible for enforcing child support orders?,5,4,2
4/27/2026 16:03:08,R1777296599077351,Indiana Child Support,Who is responsible for enforcing child support orders in Indiana?,5,3,4
4/27/2026 16:03:08,R1777296599077351,Indiana Child Support,"Is this about a specific case or situation involving child support in Indiana, such as a custody dispute or a request for modification?",5,5,5
4/27/2026 16:03:08,R1777296599077351,Indiana Child Support,Is Indiana a state that requires child support?,5,4,2
4/27/2026 16:03:08,R1777296599077351,Arizona Game And Fish,Is there a specific type of license or permit required for fishing in Arizona?,5,3,4
4/27/2026 16:03:08,R1777296599077351,Arizona Game And Fish,What role does Arizona Game and Fish play in managing wildlife populations?,5,4,3
4/27/2026 16:03:08,R1777296599077351,Arizona Game And Fish,What is the primary purpose of the Arizona Game and Fish Department?,5,3,3
