Timestamp,Respondent ID,Topic,Question Text,Fluency,Relevance,Usefulness
4/28/2026 11:24:26,R1777302240141788,Starbucks,Is Starbucks referring to the specific coffee shop chain or is it also related to the celestial body?,4,2,2
4/28/2026 11:24:26,R1777302240141788,Starbucks,Is Starbucks a coffee shop?,5,5,5
4/28/2026 11:24:27,R1777302240141788,Starbucks,What is the intended meaning of starbucks?,4,4,2
4/28/2026 11:24:27,R1777302240141788,Starbucks,"Who is Howard Schultz, the former CEO of Starbucks?",5,5,5
4/28/2026 11:24:27,R1777302240141788,Vldl Levels,What are the typical VLDL levels considered normal or healthy in adults?,5,5,5
4/28/2026 11:24:27,R1777302240141788,Vldl Levels,What are the typical contexts in which VLDL levels are measured?,4,3,4
4/28/2026 11:24:27,R1777302240141788,Vldl Levels,Is LDL cholesterol a component of VLDL?,4,4,5
4/28/2026 11:24:27,R1777302240141788,Vldl Levels,"What specific type of LDL cholesterol levels are you referring to (e.g., total, HDL, LDL particle count)?",5,5,5
4/28/2026 11:24:27,R1777302240141788,Vldl Levels,What is the intended meaning of vldl levels?,3,3,2
4/28/2026 11:24:28,R1777302240141788,Euclid,Is Euclid a Greek mathematician?,5,5,5
4/28/2026 11:24:28,R1777302240141788,Euclid,What is the historical context in which Euclid's works were written?,4,4,5
4/28/2026 11:24:28,R1777302240141788,Euclid,Who is Euclid in the context of mathematics?,5,5,5
4/28/2026 11:24:28,R1777302240141788,Euclid,Was Euclid referring to the ancient Greek mathematician or the mathematical concept of Euclidean geometry?,4,1,1
4/28/2026 11:24:28,R1777302240141788,Euclid,What is the intended meaning of euclid?,4,4,3
4/28/2026 11:24:28,R1777302240141788,Dieting,What specific health concern or goal are you trying to address through dieting?,5,5,5
4/28/2026 11:24:28,R1777302240141788,Dieting,What is the intended meaning of dieting?,4,2,2
4/28/2026 11:24:29,R1777302240141788,Dieting,"What specific aspect of dieting are you looking to learn more about, such as weight loss strategies or nutrition plans?",5,5,5
4/28/2026 11:24:29,R1777302240141788,Dieting,What is the primary goal of most people who engage in dieting?,5,5,5
4/28/2026 11:24:29,R1777302240141788,Dieting,Is dieting typically associated with weight loss?,5,5,5
4/28/2026 11:24:29,R1777302240141788,Dnr,What is the intended meaning of dnr?,3,4,4
4/28/2026 11:24:29,R1777302240141788,Dnr,Is a DNR order typically made by a patient?,4,3,5
4/28/2026 11:24:29,R1777302240141788,Dnr,Do you have any information about the meaning of DNR in medical contexts?,5,5,4
4/28/2026 11:24:30,R1777302240141788,Dnr,Is DNR an abbreviation for a specific medical condition or is it related to a particular industry or context?,5,5,5
4/28/2026 11:24:30,R1777302240141788,Dnr,What specific medical condition requires a Do Not Resuscitate order?,3,4,4
4/28/2026 11:24:31,R1777302240141788,Battles In The Civil War,Was the American Civil War primarily fought between the Union (the Northern states) and the Confederacy (the Southern states)?,5,5,5
4/28/2026 11:24:31,R1777302240141788,Battles In The Civil War,Were there any naval battles during the American Civil War?,5,5,5
4/28/2026 11:24:31,R1777302240141788,Battles In The Civil War,What were some of the most significant battles fought during the American Civil War?,4,4,4
4/28/2026 11:24:31,R1777302240141788,Battles In The Civil War,What were the primary causes of the battles fought during the American Civil War?,5,5,5
4/28/2026 11:24:31,R1777302240141788,Website Design Hosting,What role in website design hosting typically requires expertise in both front-end development and back-end server management?,5,5,5
4/28/2026 11:24:31,R1777302240141788,Website Design Hosting,Is the query related to a specific type of hosting service?,4,2,2
4/28/2026 11:24:32,R1777302240141788,Website Design Hosting,What types of websites can be effectively hosted on shared or dedicated servers?,4,2,3
4/28/2026 11:24:32,R1777302240141788,Website Design Hosting,"Is there a specific type of website (e.g., e-commerce, blog, portfolio) that you are looking to host?",5,5,5
4/28/2026 11:24:32,R1777302240141788,Website Design Hosting,What is the role of identity in website design hosting?,3,2,3
4/28/2026 11:24:32,R1777302240141788,Rock Art,Is rock art typically created for aesthetic purposes?,5,5,5
4/28/2026 11:24:32,R1777302240141788,Rock Art,Who created the earliest known examples of rock art?,4,2,2
4/28/2026 11:24:33,R1777302240141788,Rock Art,What is the intended meaning of rock art?,4,4,3
4/28/2026 11:24:33,R1777302240141788,Rock Art,"Is the specific type of rock art being referred to, such as petroglyphs or pictographs?",5,5,5
4/28/2026 11:24:33,R1777302240141788,Sit And Reach Test,What is the primary purpose of the sit and reach test in physical therapy or occupational assessment?,3,4,4
4/28/2026 11:24:34,R1777302240141788,Sit And Reach Test,Is the sit and reach test used to assess flexibility?,4,4,4
4/28/2026 11:24:34,R1777302240141788,Sit And Reach Test,"What specific aspect of the sit and reach test is being measured, such as flexibility or range of motion?",3,4,4
4/28/2026 11:24:34,R1777302240141788,Sit And Reach Test,What is the purpose of the sit and reach test in relation to identifying individuals with musculoskeletal disorders?,4,5,5
4/28/2026 11:24:34,R1777302240141788,The Wall,What is the intended meaning of the wall?,4,2,2
4/28/2026 11:24:34,R1777302240141788,The Wall,"What is the specific need that ""the wall"" refers to?",5,5,5
4/28/2026 11:24:34,R1777302240141788,The Wall,What is the purpose of a typical wall in a building?,5,5,5
4/28/2026 11:24:35,R1777302240141788,The Wall,Is the wall a physical structure?,3,2,2
4/28/2026 11:24:35,R1777302240141788,The Wall,"Is ""the wall"" referring to a specific physical structure, such as a building or a barrier, rather than an abstract concept?",5,5,5
4/28/2026 11:24:35,R1777302240141788,Vanuatu,Is Vanuatu a country?,5,4,5
4/28/2026 11:24:35,R1777302240141788,Vanuatu,Is Vanuatu an independent country or a former French colony?,5,5,5
4/28/2026 11:24:35,R1777302240141788,Vanuatu,What is the geographical location of Vanuatu?,4,3,4
4/28/2026 11:24:35,R1777302240141788,Vanuatu,Is Vanuatu a country or an island nation?,5,5,5
4/28/2026 11:24:35,R1777302240141788,Vanuatu,What is the intended meaning of vanuatu?,4,2,3
4/28/2026 11:24:36,R1777302240141788,Kiwi,Is the kiwi a type of fruit or a specific variety?,5,5,5
4/28/2026 11:24:36,R1777302240141788,Kiwi,Is kiwi a type of fruit?,4,4,4
4/28/2026 11:24:36,R1777302240141788,Kiwi,"Is the specific type of kiwi being referred to (e.g. Hayward, Golden, Chinese)?",4,2,2
4/28/2026 11:24:36,R1777302240141788,Kiwi,What is the intended meaning of kiwi?,3,3,4
4/28/2026 11:24:36,R1777302240141788,Kiwi,What is the specific nutritional need that kiwi fruit is commonly used to support?,5,5,5
4/28/2026 11:24:36,R1777302240141788,Dangers Of Asbestos,Is asbestos still used in many industries today?,5,5,5
4/28/2026 11:24:37,R1777302240141788,Dangers Of Asbestos,What is the current average cost per ton of asbestos for demolition and removal projects?,3,2,2
4/28/2026 11:24:38,R1777302240141788,Dangers Of Asbestos,What specific health effects can asbestos cause in humans?,5,5,5
4/28/2026 11:24:39,R1777302240141788,Dangers Of Asbestos,What specific type of asbestos exposure or situation would you like to know more about?,4,3,3
4/28/2026 11:24:39,R1777302240141788,Dangers Of Asbestos,What types of asbestos are most commonly associated with health risks?,5,5,5
4/28/2026 11:24:39,R1777302240141788,Iron,What is the primary role of iron in the human body?,5,5,5
4/28/2026 11:24:39,R1777302240141788,Iron,"Is the specific type of iron (e.g., steel, cast iron, wrought iron) being referred to?",5,5,5
4/28/2026 11:24:39,R1777302240141788,Iron,What is the intended meaning of iron?,3,2,2
4/28/2026 11:24:39,R1777302240141788,Iron,What context is being referred to when discussing iron?,4,4,3
4/28/2026 11:24:40,R1777302240141788,Iron,Is iron a metal?,4,4,4
4/28/2026 11:24:40,R1777302240141788,The Secret Garden,"What role did Frances Hodgson Burnett play in adapting her novel ""The Secret Garden"" into a stage play?",5,5,5
4/28/2026 11:24:40,R1777302240141788,The Secret Garden,"Was the Secret Garden by Frances Hodgson Burnett set in Yorkshire, England?",4,3,4
4/28/2026 11:24:40,R1777302240141788,The Secret Garden,Is the Secret Garden a fictional work?,5,5,5
4/28/2026 11:24:40,R1777302240141788,The Secret Garden,"What is the identity of the main character in ""The Secret Garden""?",4,4,5
4/28/2026 11:24:40,R1777302240141788,The Secret Garden,Who is Mary Lennox in the story of The Secret Garden?,5,5,3
4/28/2026 11:24:41,R1777302240141788,Indiana Child Support,What is the name of the Indiana agency responsible for enforcing child support orders?,5,5,5
4/28/2026 11:24:41,R1777302240141788,Indiana Child Support,Who is responsible for enforcing child support orders in Indiana?,4,5,4
4/28/2026 11:24:41,R1777302240141788,Indiana Child Support,Is Indiana a state that requires child support?,5,4,4
4/28/2026 11:24:41,R1777302240141788,Indiana Child Support,"Is this about a specific case or situation involving child support in Indiana, such as a custody dispute or a request for modification?",4,2,3
4/28/2026 11:24:41,R1777302240141788,Arizona Game And Fish,What is the primary purpose of the Arizona Game and Fish Department?,4,5,5
4/28/2026 11:24:41,R1777302240141788,Arizona Game And Fish,Does Arizona have a department of natural resources?,5,5,5
4/28/2026 11:24:41,R1777302240141788,Arizona Game And Fish,Is there a specific type of license or permit required for fishing in Arizona?,4,2,2
4/28/2026 11:24:42,R1777302240141788,Arizona Game And Fish,What role does Arizona Game and Fish play in managing wildlife populations?,4,4,5
4/28/2026 11:24:42,R1777302240141788,Arizona Game And Fish,What notable contribution did Arizona make to the conservation of native wildlife?,5,5,5
4/28/2026 11:24:42,R1777302240141788,Map Of The United States,What is the scale of this map?,4,2,1
4/28/2026 11:24:44,R1777302240141788,Map Of The United States,Is the query about a physical map?,5,5,5
4/28/2026 11:24:44,R1777302240141788,Map Of The United States,Is there a specific region or state within the United States that you would like to see mapped?,5,5,5
4/28/2026 11:24:44,R1777302240141788,Map Of The United States,What geographic region of the United States is typically considered to be part of North America?,4,3,4
4/28/2026 11:24:44,R1777302240141788,Designer Dog Breeds,Are there any specific characteristics or features you'd like me to focus on when discussing designer dog breeds?,5,5,5
4/28/2026 11:24:44,R1777302240141788,Designer Dog Breeds,Are designer dog breeds recognized by major kennel clubs?,4,3,4
4/28/2026 11:24:44,R1777302240141788,Designer Dog Breeds,What is the primary purpose of creating these hybrid breeds?,5,5,5
4/28/2026 11:24:45,R1777302240141788,Designer Dog Breeds,What careers are typically associated with designer dog breeds?,4,3,4
4/28/2026 11:24:45,R1777302240141788,Designer Dog Breeds,What are some designer dog breeds that originated from specific breed combinations?,5,3,4
4/28/2026 11:24:45,R1777302240141788,Neil Young,What is Neil Young's role as an environmental activist?,5,5,5
4/28/2026 11:24:45,R1777302240141788,Neil Young,Is Neil Young a musician?,5,4,4
4/28/2026 11:24:45,R1777302240141788,Neil Young,What is the intended meaning of neil young?,4,2,2
4/28/2026 11:24:45,R1777302240141788,Neil Young,Was Neil Young primarily associated with the folk rock genre?,4,5,5
4/28/2026 11:24:45,R1777302240141788,Neil Young,What is the intended meaning of Neil Young's music?,3,2,2
4/28/2026 11:24:46,R1777302240141788,Gs Pay Rate,What is the typical GS pay rate for a specific role in the federal government?,5,5,5
4/28/2026 11:24:46,R1777302240141788,Gs Pay Rate,"Is there a specific industry or job type associated with the ""gs"" pay rate?",5,5,5
4/28/2026 11:24:46,R1777302240141788,Gs Pay Rate,Is GS pay rates publicly disclosed?,4,3,4
4/28/2026 11:24:46,R1777302240141788,Gs Pay Rate,Who determines the GS pay rates?,4,5,4
4/28/2026 11:24:46,R1777302240141788,Gs Pay Rate,What is the pay rate for GS employees?,4,2,3
4/28/2026 11:24:46,R1777302240141788,Defender,Who is typically considered the primary defender of a country's sovereignty?,5,4,4
4/28/2026 11:24:47,R1777302240141788,Defender,What is the intended meaning of defender?,4,3,3
4/28/2026 11:24:47,R1777302240141788,Defender,"Is the term ""defender"" referring to a specific type of device or system, such as a computer security software?",5,5,5
4/28/2026 11:24:47,R1777302240141788,Defender,Is a defender typically associated with sports?,5,5,4
4/28/2026 11:24:47,R1777302240141788,Map Of Brazil,What is the scale of the map?,4,3,3
4/28/2026 11:24:47,R1777302240141788,Map Of Brazil,What notable geographical features are located in Brazil?,5,5,5
4/28/2026 11:24:47,R1777302240141788,Map Of Brazil,"Is it a specific region within Brazil (e.g. Amazon rainforest, Northeastern states) that you would like to see on the map?",5,5,5
4/28/2026 11:24:49,R1777302240141788,Map Of Brazil,Is Brazil a country?,4,4,3
4/28/2026 11:24:49,R1777302240141788,Map Of Brazil,What is Brazil's geographical location?,5,5,5
4/28/2026 11:24:49,R1777302240141788,Equal Opportunity Employer,What is the primary purpose of an equal opportunity employer?,5,5,5
4/28/2026 11:24:49,R1777302240141788,Equal Opportunity Employer,Does an equal opportunity employer actively seek to hire candidates from underrepresented groups?,4,4,3
4/28/2026 11:24:50,R1777302240141788,Equal Opportunity Employer,What role or career is being referred to in the context of an equal opportunity employer?,5,5,5
4/28/2026 11:24:51,R1777302240141788,Equal Opportunity Employer,Is an equal opportunity employer typically defined by specific geographic location or region?,3,2,2
4/28/2026 11:24:51,R1777302240141788,Who Invented Music,Was there a single inventor of music?,4,3,3
4/28/2026 11:24:52,R1777302240141788,Who Invented Music,Who is credited with being one of the earliest known composers in history?,5,5,5
4/28/2026 11:24:52,R1777302240141788,Who Invented Music,Was the origin of music attributed to a specific culture or civilization?,4,3,4
4/28/2026 11:24:52,R1777302240141788,Who Invented Music,What is the name of the person credited with inventing music?,5,5,5