Timestamp,Respondent ID,Topic,Question Text,Fluency,Relevance,Usefulness
4/27/2026 16:03:09,R1777296599077351,Arizona Game And Fish,Does Arizona have a department of natural resources?,5,5,3
4/27/2026 16:03:09,R1777296599077351,Arizona Game And Fish,What notable contribution did Arizona make to the conservation of native wildlife?,5,4,4
4/27/2026 16:03:09,R1777296599077351,Map Of The United States,Is there a specific region or state within the United States that you would like to see mapped?,5,3,5
4/27/2026 16:03:09,R1777296599077351,Map Of The United States,Is the query about a physical map?,5,5,3
4/27/2026 16:03:09,R1777296599077351,Map Of The United States,What geographic region of the United States is typically considered to be part of North America?,5,4,3
4/27/2026 16:03:10,R1777296599077351,Map Of The United States,What is the scale of this map?,5,3,3
4/27/2026 16:03:10,R1777296599077351,Designer Dog Breeds,What is the primary purpose of creating these hybrid breeds?,5,4,3
4/27/2026 16:03:10,R1777296599077351,Designer Dog Breeds,What careers are typically associated with designer dog breeds?,5,5,4
4/27/2026 16:03:10,R1777296599077351,Designer Dog Breeds,Are there any specific characteristics or features you'd like me to focus on when discussing designer dog breeds?,5,3,4
4/27/2026 16:03:10,R1777296599077351,Designer Dog Breeds,What are some designer dog breeds that originated from specific breed combinations?,5,4,5
4/27/2026 16:03:10,R1777296599077351,Designer Dog Breeds,Are designer dog breeds recognized by major kennel clubs?,5,4,4
4/27/2026 16:03:11,R1777296599077351,Neil Young,What is the intended meaning of neil young?,5,2,2
4/27/2026 16:03:11,R1777296599077351,Neil Young,What is Neil Young's role as an environmental activist?,5,3,3
4/27/2026 16:03:11,R1777296599077351,Neil Young,What is the intended meaning of Neil Young's music?,5,3,2
4/27/2026 16:03:11,R1777296599077351,Neil Young,Was Neil Young primarily associated with the folk rock genre?,5,4,5
4/27/2026 16:03:11,R1777296599077351,Neil Young,Is Neil Young a musician?,5,5,4
4/27/2026 16:03:11,R1777296599077351,Gs Pay Rate,What is the typical GS pay rate for a specific role in the federal government?,5,4,4
4/27/2026 16:03:11,R1777296599077351,Gs Pay Rate,"Is there a specific industry or job type associated with the ""gs"" pay rate?",5,4,2
4/27/2026 16:03:12,R1777296599077351,Gs Pay Rate,Is GS pay rates publicly disclosed?,5,3,4
4/27/2026 16:03:12,R1777296599077351,Gs Pay Rate,What is the pay rate for GS employees?,5,2,4
4/27/2026 16:03:12,R1777296599077351,Gs Pay Rate,Who determines the GS pay rates?,5,4,3
4/27/2026 16:03:12,R1777296599077351,Defender,Who is typically considered the primary defender of a country's sovereignty?,5,4,3
4/27/2026 16:03:13,R1777296599077351,Defender,"Is the term ""defender"" referring to a specific type of device or system, such as a computer security software?",5,5,4
4/27/2026 16:03:13,R1777296599077351,Defender,What is the intended meaning of defender?,5,1,1
4/27/2026 16:03:13,R1777296599077351,Defender,Is a defender typically associated with sports?,5,2,4
4/27/2026 16:03:13,R1777296599077351,Map Of Brazil,What is the scale of the map?,5,1,3
4/27/2026 16:03:13,R1777296599077351,Map Of Brazil,What is Brazil's geographical location?,5,4,4
4/27/2026 16:03:13,R1777296599077351,Map Of Brazil,"Is it a specific region within Brazil (e.g. Amazon rainforest, Northeastern states) that you would like to see on the map?",5,5,5
4/27/2026 16:03:13,R1777296599077351,Map Of Brazil,Is Brazil a country?,5,3,2
4/27/2026 16:03:14,R1777296599077351,Map Of Brazil,What notable geographical features are located in Brazil?,5,4,5
4/27/2026 16:03:14,R1777296599077351,Equal Opportunity Employer,What role or career is being referred to in the context of an equal opportunity employer?,5,5,4
4/27/2026 16:03:14,R1777296599077351,Equal Opportunity Employer,What is the primary purpose of an equal opportunity employer?,5,5,4
4/27/2026 16:03:14,R1777296599077351,Equal Opportunity Employer,Does an equal opportunity employer actively seek to hire candidates from underrepresented groups?,5,4,3
4/27/2026 16:03:14,R1777296599077351,Equal Opportunity Employer,Is an equal opportunity employer typically defined by specific geographic location or region?,5,4,4
4/27/2026 16:03:14,R1777296599077351,Who Invented Music,What is the name of the person credited with inventing music?,5,4,5
4/27/2026 16:03:15,R1777296599077351,Who Invented Music,Who is credited with being one of the earliest known composers in history?,5,4,3
4/27/2026 16:03:15,R1777296599077351,Who Invented Music,Was there a single inventor of music?,5,4,2
4/27/2026 16:03:15,R1777296599077351,Who Invented Music,Was the origin of music attributed to a specific culture or civilization?,5,4,4
4/27/2026 19:35:22,R1777300925002483,Porterville,Is Porterville a city in California?,5,5,3
4/27/2026 19:35:22,R1777300925002483,Porterville,"Is Porterville a specific city or location you're referring to, such as in California?",5,5,4
4/27/2026 19:35:23,R1777300925002483,Porterville,What is the intended meaning of porterville?,4,4,2
4/27/2026 19:35:23,R1777300925002483,Porterville,What is Porterville known for in terms of its economy or industry?,5,4,3
4/27/2026 19:35:23,R1777300925002483,Porterville,What is Porterville's primary economic industry?,4,4,3
4/27/2026 19:35:23,R1777300925002483,Rick Warren,What is the intended meaning of rick warren?,4,3,2
4/27/2026 19:35:24,R1777300925002483,Rick Warren,Is Rick Warren a Christian author?,5,3,3
4/27/2026 19:35:24,R1777300925002483,Rick Warren,Who is Rick Warren's primary audience for his books and sermons?,5,4,3
4/27/2026 19:35:24,R1777300925002483,Rick Warren,Is Rick Warren's focus on spiritual growth and leadership primarily geared towards Christians or also applicable to other faiths?,5,4,4
4/27/2026 19:35:24,R1777300925002483,Adobe Indian Houses,"Who were the Adobe Indian people, and what was their traditional way of life?",5,2,2
4/27/2026 19:35:25,R1777300925002483,Adobe Indian Houses,Are Adobe Indian houses typically found in dry desert regions?,5,4,4
4/27/2026 19:35:25,R1777300925002483,Adobe Indian Houses,What type of traditional Indian houses are commonly associated with Adobe construction?,5,4,3
4/27/2026 19:35:25,R1777300925002483,Adobe Indian Houses,What role did traditional Indian houses play in the daily lives of their occupants?,4,2,1
4/27/2026 19:35:26,R1777300925002483,Adobe Indian Houses,"What specific type of Adobe Indian house are you referring to, such as a Pueblo or Anasazi dwelling?",4,4,4
4/27/2026 19:35:26,R1777300925002483,Indexed Annuity,What is the primary benefit of investing in an indexed annuity?,5,4,4
4/27/2026 19:35:26,R1777300925002483,Indexed Annuity,Is an indexed annuity tied to a specific inflation index?,5,4,3
4/27/2026 19:35:26,R1777300925002483,Indexed Annuity,What is the intended meaning of indexed annuity?,4,3,2
4/27/2026 19:35:26,R1777300925002483,Indexed Annuity,"Is an indexed annuity specifically tied to a particular market index, such as the S&P 500?",5,4,4
4/27/2026 19:35:27,R1777300925002483,Bellevue,Is Bellevue referring to the city in Washington state or another location?,4,4,4
4/27/2026 19:35:27,R1777300925002483,Bellevue,Is Bellevue a specific city or location?,4,4,3
4/27/2026 19:35:27,R1777300925002483,Bellevue,What is the context in which Bellevue refers to?,4,3,2
4/27/2026 19:35:27,R1777300925002483,Bellevue,Is Bellevue a city?,5,4,3
4/27/2026 19:35:27,R1777300925002483,Bellevue,What is the intended meaning of bellevue?,4,4,2
4/27/2026 19:35:28,R1777300925002483,Elliptical Trainer,What is the typical target area of an elliptical trainer for users with joint issues?,4,4,4
4/27/2026 19:35:28,R1777300925002483,Elliptical Trainer,What is the intended purpose of an elliptical trainer?,4,3,2
4/27/2026 19:35:28,R1777300925002483,Elliptical Trainer,What is the intended meaning of elliptical trainer?,4,3,2
4/27/2026 19:35:28,R1777300925002483,Elliptical Trainer,"Is there a specific type of elliptical trainer (e.g. home gym, commercial use, budget range) you are looking for more information on?",5,5,5
4/27/2026 19:35:29,R1777300925002483,Elliptical Trainer,Is an elliptical trainer a type of cardio machine?,5,4,4
4/27/2026 19:35:29,R1777300925002483,Alexian Brothers Hospital,What is the role of Alexian Brothers Hospital in providing healthcare services to the community?,4,4,4
4/27/2026 19:35:29,R1777300925002483,Alexian Brothers Hospital,What is the primary role or function of Alexian Brothers Hospital in serving its community?,5,4,4
4/27/2026 19:35:29,R1777300925002483,Alexian Brothers Hospital,"Is Alexian Brothers Hospital located in Peoria, Illinois?",5,4,3
4/27/2026 19:35:30,R1777300925002483,Alexian Brothers Hospital,Is Alexian Brothers Hospital a real medical facility?,5,4,3
4/27/2026 19:35:30,R1777300925002483,Alexian Brothers Hospital,What notable medical innovation did Alexian Brothers Hospital develop?,5,4,4
4/27/2026 19:35:30,R1777300925002483,Dutchess County Tourism,"What is the primary target audience for Dutchess County Tourism, and how do they differ from other regional tourist groups?",5,4,3
4/27/2026 19:35:30,R1777300925002483,Dutchess County Tourism,Is Dutchess County a popular tourist destination?,5,4,3
4/27/2026 19:35:30,R1777300925002483,Dutchess County Tourism,What nearby attractions are there in Dutchess County that complement its historic sites and natural beauty?,5,4,3
4/27/2026 19:35:32,R1777300925002483,Dutchess County Tourism,What seasonal events are typically held in Dutchess County?,5,4,4
4/27/2026 19:35:33,R1777300925002483,Dutchess County Tourism,Is Dutchess County in New York State?,5,3,3
4/27/2026 19:35:33,R1777300925002483,California Franchise Tax Board,"Is the California Franchise Tax Board (FTB) primarily responsible for taxing businesses operating in California, or are there specific industries or types of businesses that may be subject to different tax regulations?",5,4,4
4/27/2026 19:35:33,R1777300925002483,California Franchise Tax Board,What is the name of the California state agency responsible for administering the franchise tax?,4,2,2
4/27/2026 19:35:33,R1777300925002483,California Franchise Tax Board,What role does the California Franchise Tax Board play in enforcing tax laws for businesses operating within the state?,5,4,4
4/27/2026 19:35:33,R1777300925002483,California Franchise Tax Board,What is the primary role of the California Franchise Tax Board in relation to businesses operating within the state?,5,4,4
4/27/2026 19:35:34,R1777300925002483,California Franchise Tax Board,Is the California Franchise Tax Board responsible for collecting taxes on businesses operating in California?,5,4,3
4/27/2026 19:35:34,R1777300925002483,To Be Or Not To Be That Is The Question,"What philosophical framework is Hamlet's famous soliloquy ""To be or not to be"" primarily rooted in?",5,4,4
4/27/2026 19:35:34,R1777300925002483,To Be Or Not To Be That Is The Question,"Is this a philosophical inquiry about existentialism, specifically referencing Shakespeare's Hamlet?",4,4,4
4/27/2026 19:35:34,R1777300925002483,To Be Or Not To Be That Is The Question,Is Hamlet the author of this famous philosophical query?,5,3,3
4/27/2026 19:35:34,R1777300925002483,To Be Or Not To Be That Is The Question,"What is the context in which Shakespeare's famous phrase ""to be or not to be"" appears?",5,3,3
4/27/2026 19:35:35,R1777300925002483,To Be Or Not To Be That Is The Question,Is this a philosophical inquiry?,5,3,2
4/27/2026 19:35:35,R1777300925002483,Texas Border Patrol,What role does Texas Border Patrol play in enforcing immigration laws?,5,4,4
4/27/2026 19:35:35,R1777300925002483,Texas Border Patrol,What notable contributions has the Texas Border Patrol made to border security efforts?,5,4,3
4/27/2026 19:35:35,R1777300925002483,Texas Border Patrol,Who is responsible for overseeing the operations of the Texas Border Patrol?,5,4,3
4/27/2026 19:35:35,R1777300925002483,Texas Border Patrol,Is Texas a U.S. state?,5,1,1
4/27/2026 19:35:36,R1777300925002483,Texas Border Patrol,"What specific aspect of Texas Border Patrol are you looking for information on, such as their operations, policies, or statistics?",5,5,5
4/27/2026 19:35:36,R1777300925002483,Hp Mini 2140,Is the HP Mini 2140 a discontinued model?,5,4,4
4/27/2026 19:35:36,R1777300925002483,Hp Mini 2140,Is the HP Mini 2140 a specific model year or generation that you're looking for information on?,4,4,3
4/27/2026 19:35:36,R1777300925002483,Hp Mini 2140,What is the processor speed of the HP Mini 2140?,5,4,4
4/27/2026 19:35:37,R1777300925002483,Hp Mini 2140,What is the intended meaning of hp mini 2140?,4,3,2
4/27/2026 19:35:37,R1777300925002483,Hp Mini 2140,What is the typical price range for a refurbished HP Mini 2140 laptop?,5,4,4
4/27/2026 19:35:37,R1777300925002483,Espn Sports,What is the primary role of ESPN in the sports media landscape?,5,3,3
4/27/2026 19:35:37,R1777300925002483,Espn Sports,What is the current context of ESPN's sports coverage?,4,4,3
4/27/2026 19:35:37,R1777300925002483,Espn Sports,What is the intended meaning of espn sports?,4,3,2
4/27/2026 19:35:38,R1777300925002483,Espn Sports,Is ESPN primarily a sports network?,5,4,3
4/27/2026 19:35:38,R1777300925002483,Espn Sports,"Is ESPN referring to a specific sport or league, such as NFL, NBA, MLB, or NHL?",5,3,2
4/27/2026 19:35:38,R1777300925002483,Tn Highway Patrol,"Is there a specific Tennessee Highway Patrol (THP) unit or division you are referring to, such as the THP's traffic enforcement efforts?",5,5,4
4/27/2026 19:35:38,R1777300925002483,Tn Highway Patrol,What notable contributions has the Tennessee Highway Patrol made to highway safety?,5,4,3
4/27/2026 19:35:39,R1777300925002483,Tn Highway Patrol,What role does the Tennessee Highway Patrol play in enforcing traffic laws?,5,4,4
4/27/2026 19:35:39,R1777300925002483,Tn Highway Patrol,Is the Tennessee Highway Patrol a law enforcement agency?,5,4,3
4/27/2026 19:35:39,R1777300925002483,Tn Highway Patrol,Who is responsible for enforcing traffic laws along Tennessee highways?,5,2,1
4/27/2026 19:35:39,R1777300925002483,East Ridge High School,Is East Ridge High School a public school?,5,4,3
4/27/2026 19:35:40,R1777300925002483,East Ridge High School,What is the location of East Ridge High School?,5,4,3
4/27/2026 19:35:40,R1777300925002483,East Ridge High School,What is the current student body of East Ridge High School?,4,4,3
4/27/2026 19:35:40,R1777300925002483,East Ridge High School,What is the main purpose or type of East Ridge High School?,5,4,3
4/27/2026 19:35:40,R1777300925002483,East Ridge High School,Is East Ridge High School located in Tennessee?,4,4,3
4/27/2026 19:35:40,R1777300925002483,Atari,What was the historical context in which the Atari company emerged?,5,4,3
4/27/2026 19:35:40,R1777300925002483,Atari,What is the primary purpose of the Atari brand?,5,4,3
4/27/2026 19:35:41,R1777300925002483,Atari,Is Atari a well-known video game company?,5,4,3
4/27/2026 19:35:41,R1777300925002483,Atari,Was Atari specifically referring to the classic arcade console or the video game company that developed it?,5,4,4
4/27/2026 19:35:41,R1777300925002483,Atari,What is the intended meaning of atari?,4,4,2
4/27/2026 19:35:41,R1777300925002483,Ralph Owen Brewster,What was Ralph Owen Brewster's profession?,5,4,3
4/27/2026 19:35:42,R1777300925002483,Ralph Owen Brewster,Is Ralph Owen Brewster a real person?,5,4,3
4/27/2026 19:35:42,R1777300925002483,Ralph Owen Brewster,Who was Ralph Owen Brewster?,5,4,3
4/27/2026 19:35:42,R1777300925002483,Ralph Owen Brewster,What notable scientific contribution did Ralph Owen Brewster make?,5,4,4
4/27/2026 19:35:43,R1777300925002483,Ralph Owen Brewster,Was Ralph Owen Brewster an American inventor or engineer?,5,4,3
4/27/2026 19:35:43,R1777300925002483,Avp,"What is the context in which the term ""avp"" is typically used?",5,3,2
4/27/2026 19:35:43,R1777300925002483,Avp,Is AvP a movie?,5,4,3
4/27/2026 19:35:44,R1777300925002483,Avp,"Is the query referring to the 1997 film ""Alien vs. Predator"" or perhaps a different context, such as a video game series?",5,4,4
4/27/2026 19:35:44,R1777300925002483,Avp,What is AvP in the context of video games?,4,4,3
4/27/2026 19:35:44,R1777300925002483,Avp,What is the intended meaning of avp?,4,3,2
4/27/2026 19:35:44,R1777300925002483,Best Long Term Care Insurance,What type of long-term care insurance plan is best suited for individuals with chronic health conditions?,5,4,4
4/27/2026 19:35:44,R1777300925002483,Best Long Term Care Insurance,Is long-term care insurance typically more expensive for younger individuals?,5,4,3
4/27/2026 19:35:44,R1777300925002483,Best Long Term Care Insurance,Who is typically most affected by the high costs of long-term care insurance?,5,4,3
4/27/2026 19:35:45,R1777300925002483,Best Long Term Care Insurance,"What are the specific features or benefits that you're looking for in a long-term care insurance policy, such as coverage limits, deductibles, or riders?",5,5,5
4/27/2026 19:35:45,R1777300925002483,Volvo,What is the context in which Volvo is typically associated?,5,4,2
4/27/2026 19:35:45,R1777300925002483,Volvo,Who is Volvo's primary target audience for its vehicles?,5,4,3
4/27/2026 19:35:45,R1777300925002483,Volvo,Is Volvo a car brand?,5,3,2
4/27/2026 19:35:45,R1777300925002483,Volvo,"Is it referring to the Swedish automobile manufacturer or another entity with the name ""Volvo""?",5,4,3
4/27/2026 19:35:46,R1777300925002483,Volvo,What is the intended meaning of volvo?,4,3,2
4/27/2026 19:35:46,R1777300925002483,Korean Language,Is Korean a tonal language?,5,4,3
4/27/2026 19:35:46,R1777300925002483,Korean Language,What is the intended meaning of korean language?,4,3,2
4/27/2026 19:35:46,R1777300925002483,Korean Language,What is the cultural context in which the Korean language originated?,5,4,3
4/27/2026 19:35:46,R1777300925002483,Korean Language,Is there a specific dialect or regional variation of Korean you would like to know more about?,5,4,3
4/27/2026 19:35:47,R1777300925002483,Korean Language,Is Korean a native language of South Korea?,5,4,3
4/27/2026 19:35:47,R1777300925002483,Figs,Are figs typically eaten fresh?,5,4,3
4/27/2026 19:35:47,R1777300925002483,Figs,What are some common health benefits associated with consuming figs?,5,4,4
4/27/2026 19:35:47,R1777300925002483,Figs,What is the intended meaning of figs?,4,3,2
4/27/2026 19:35:48,R1777300925002483,Figs,What type of figs are you looking for?,5,4,3
4/27/2026 19:35:48,R1777300925002483,Figs,"Are you referring to the fruit, its nutritional benefits, or perhaps a specific variety of fig?",5,5,5
4/27/2026 19:35:48,R1777300925002483,Ocd,What is OCD typically characterized by in terms of its symptoms?,5,4,4
4/27/2026 19:35:48,R1777300925002483,Ocd,Is OCD typically considered a mental health disorder?,5,4,3
4/27/2026 19:35:48,R1777300925002483,Ocd,What is the typical context in which obsessive-compulsive disorder (OCD) is typically diagnosed or discussed?,5,5,4
4/27/2026 19:35:49,R1777300925002483,Ocd,Is OCD typically associated with any specific age group or demographic?,5,4,4
4/27/2026 19:35:49,R1777300925002483,Ocd,What is the intended meaning of ocd?,3,4,2
4/27/2026 19:35:49,R1777300925002483,Computer Programming,"Is there a specific area of computer programming (e.g. web development, machine learning, game development) that you would like more information on?",5,4,4
4/27/2026 19:35:49,R1777300925002483,Computer Programming,Is computer programming a required skill for most jobs?,5,4,3
4/27/2026 19:35:49,R1777300925002483,Computer Programming,What is the intended meaning of computer programming?,4,3,2
4/27/2026 19:35:50,R1777300925002483,Computer Programming,What is the primary role of a compiler in the process of writing code?,5,3,2
4/27/2026 19:35:50,R1777300925002483,Computer Programming,What is the primary context in which computer programming is typically applied?,5,4,3
4/27/2026 19:35:50,R1777300925002483,Furniture For Small Spaces,What type of furniture is best suited for small spaces?,5,4,3
4/27/2026 19:35:50,R1777300925002483,Furniture For Small Spaces,What types of furniture are best suited for narrow hallways or staircases in small apartments?,5,5,4
4/27/2026 19:35:50,R1777300925002483,Furniture For Small Spaces,"What specific type of furniture are you looking to purchase for your small space, such as compact sofas or foldable tables?",5,5,4
4/27/2026 19:35:51,R1777300925002483,Furniture For Small Spaces,Is budget a consideration when selecting furniture for small spaces?,5,4,3
4/27/2026 19:35:51,R1777300925002483,Furniture For Small Spaces,"What type of furniture is most suitable for individuals with limited mobility, such as those in small spaces?",5,4,3
4/27/2026 19:35:51,R1777300925002483,Starbucks,Is Starbucks referring to the specific coffee shop chain or is it also related to the celestial body?,5,4,4
4/27/2026 19:35:51,R1777300925002483,Starbucks,Is Starbucks a coffee shop?,5,4,3
4/27/2026 19:35:51,R1777300925002483,Starbucks,"Who is Howard Schultz, the former CEO of Starbucks?",5,4,3
4/27/2026 19:35:52,R1777300925002483,Starbucks,What is the typical context in which Starbucks operates?,5,4,2
4/27/2026 19:35:52,R1777300925002483,Starbucks,What is the intended meaning of starbucks?,4,4,2
4/27/2026 19:35:52,R1777300925002483,Vldl Levels,What are the typical VLDL levels considered normal or healthy in adults?,5,4,4
4/27/2026 19:35:52,R1777300925002483,Vldl Levels,"What specific type of LDL cholesterol levels are you referring to (e.g., total, HDL, LDL particle count)?",5,4,4
4/27/2026 19:35:53,R1777300925002483,Vldl Levels,What is the intended meaning of vldl levels?,4,3,2
4/27/2026 19:35:53,R1777300925002483,Vldl Levels,Is LDL cholesterol a component of VLDL?,5,4,3
4/27/2026 19:35:53,R1777300925002483,Vldl Levels,What are the typical contexts in which VLDL levels are measured?,5,4,3
4/27/2026 19:35:53,R1777300925002483,Euclid,What is the historical context in which Euclid's works were written?,5,4,3
4/27/2026 19:35:53,R1777300925002483,Euclid,Who is Euclid in the context of mathematics?,5,4,3
4/27/2026 19:35:53,R1777300925002483,Euclid,Was Euclid referring to the ancient Greek mathematician or the mathematical concept of Euclidean geometry?,5,5,4
4/27/2026 19:35:54,R1777300925002483,Euclid,Is Euclid a Greek mathematician?,5,4,3
4/27/2026 19:35:54,R1777300925002483,Euclid,What is the intended meaning of euclid?,4,3,2
4/27/2026 19:35:54,R1777300925002483,Dieting,Is dieting typically associated with weight loss?,5,4,3
4/27/2026 19:35:55,R1777300925002483,Dieting,What is the primary goal of most people who engage in dieting?,5,4,3
4/27/2026 19:35:55,R1777300925002483,Dieting,What is the intended meaning of dieting?,4,3,2
4/27/2026 19:35:55,R1777300925002483,Dieting,What specific health concern or goal are you trying to address through dieting?,5,4,4
4/27/2026 19:35:55,R1777300925002483,Dieting,"What specific aspect of dieting are you looking to learn more about, such as weight loss strategies or nutrition plans?",5,5,5
4/27/2026 19:35:55,R1777300925002483,Dnr,Do you have any information about the meaning of DNR in medical contexts?,5,4,3
4/27/2026 19:35:56,R1777300925002483,Dnr,Is a DNR order typically made by a patient?,5,4,4
4/27/2026 19:35:56,R1777300925002483,Dnr,What specific medical condition requires a Do Not Resuscitate order?,5,4,4
4/27/2026 19:35:56,R1777300925002483,Dnr,What is the intended meaning of dnr?,4,3,2
4/27/2026 19:35:56,R1777300925002483,Dnr,Is DNR an abbreviation for a specific medical condition or is it related to a particular industry or context?,5,4,4
4/27/2026 19:35:56,R1777300925002483,Battles In The Civil War,What were some of the most significant battles fought during the American Civil War?,5,4,4
4/27/2026 19:35:57,R1777300925002483,Battles In The Civil War,What were the primary causes of the battles fought during the American Civil War?,5,4,4
4/27/2026 19:35:57,R1777300925002483,Battles In The Civil War,Were there any naval battles during the American Civil War?,5,4,4
4/27/2026 19:35:57,R1777300925002483,Battles In The Civil War,Was the American Civil War primarily fought between the Union (the Northern states) and the Confederacy (the Southern states)?,5,4,4
4/27/2026 19:35:57,R1777300925002483,Website Design Hosting,Is the query related to a specific type of hosting service?,5,4,3
4/27/2026 19:35:57,R1777300925002483,Website Design Hosting,What is the role of identity in website design hosting?,5,4,3
4/27/2026 19:35:57,R1777300925002483,Website Design Hosting,"Is there a specific type of website (e.g., e-commerce, blog, portfolio) that you are looking to host?",5,5,4
4/27/2026 19:35:58,R1777300925002483,Website Design Hosting,What role in website design hosting typically requires expertise in both front-end development and back-end server management?,5,5,4
4/27/2026 19:35:58,R1777300925002483,Website Design Hosting,What types of websites can be effectively hosted on shared or dedicated servers?,5,5,4
4/27/2026 19:35:58,R1777300925002483,Rock Art,"Is the specific type of rock art being referred to, such as petroglyphs or pictographs?",4,5,4
4/27/2026 19:35:58,R1777300925002483,Rock Art,What is the intended meaning of rock art?,4,3,2
4/27/2026 19:35:59,R1777300925002483,Rock Art,Is rock art typically created for aesthetic purposes?,5,4,4
4/27/2026 19:35:59,R1777300925002483,Rock Art,Who created the earliest known examples of rock art?,5,4,4
4/27/2026 19:35:59,R1777300925002483,Sit And Reach Test,What is the primary purpose of the sit and reach test in physical therapy or occupational assessment?,5,5,4
