Timestamp,Respondent ID,Topic,Question Text,Fluency,Relevance,Usefulness
4/27/2026 19:35:59,R1777300925002483,Sit And Reach Test,"What specific aspect of the sit and reach test is being measured, such as flexibility or range of motion?",5,5,4
4/27/2026 19:35:59,R1777300925002483,Sit And Reach Test,Is the sit and reach test used to assess flexibility?,5,4,4
4/27/2026 19:36:00,R1777300925002483,Sit And Reach Test,What is the purpose of the sit and reach test in relation to identifying individuals with musculoskeletal disorders?,5,5,4
4/27/2026 19:36:00,R1777300925002483,The Wall,"What is the specific need that ""the wall"" refers to?",5,4,2
4/27/2026 19:36:00,R1777300925002483,The Wall,What is the intended meaning of the wall?,4,3,2
4/27/2026 19:36:00,R1777300925002483,The Wall,Is the wall a physical structure?,5,4,3
4/27/2026 19:36:00,R1777300925002483,The Wall,What is the purpose of a typical wall in a building?,5,4,3
4/27/2026 19:36:00,R1777300925002483,The Wall,"Is ""the wall"" referring to a specific physical structure, such as a building or a barrier, rather than an abstract concept?",5,5,5
4/27/2026 19:36:01,R1777300925002483,Vanuatu,What is the intended meaning of vanuatu?,4,3,2
4/27/2026 19:36:02,R1777300925002483,Vanuatu,Is Vanuatu a country or an island nation?,5,4,3
4/27/2026 19:36:02,R1777300925002483,Vanuatu,What is the geographical location of Vanuatu?,5,4,4
4/27/2026 19:36:02,R1777300925002483,Vanuatu,Is Vanuatu a country?,5,4,3
4/27/2026 19:36:02,R1777300925002483,Vanuatu,Is Vanuatu an independent country or a former French colony?,5,5,4
4/27/2026 19:36:02,R1777300925002483,Kiwi,Is kiwi a type of fruit?,5,4,3
4/27/2026 19:36:02,R1777300925002483,Kiwi,What is the specific nutritional need that kiwi fruit is commonly used to support?,4,4,4
4/27/2026 19:36:03,R1777300925002483,Kiwi,"Is the specific type of kiwi being referred to (e.g. Hayward, Golden, Chinese)?",4,4,4
4/27/2026 19:36:03,R1777300925002483,Kiwi,Is the kiwi a type of fruit or a specific variety?,4,4,4
4/27/2026 19:36:03,R1777300925002483,Kiwi,What is the intended meaning of kiwi?,4,3,2
4/27/2026 19:36:03,R1777300925002483,Dangers Of Asbestos,Is asbestos still used in many industries today?,5,1,1
4/27/2026 19:36:03,R1777300925002483,Dangers Of Asbestos,What specific health effects can asbestos cause in humans?,5,3,3
4/27/2026 19:36:04,R1777300925002483,Dangers Of Asbestos,What types of asbestos are most commonly associated with health risks?,5,4,4
4/27/2026 19:36:04,R1777300925002483,Dangers Of Asbestos,What specific type of asbestos exposure or situation would you like to know more about?,5,4,3
4/27/2026 19:36:04,R1777300925002483,Dangers Of Asbestos,What is the current average cost per ton of asbestos for demolition and removal projects?,5,2,2
4/27/2026 19:36:04,R1777300925002483,Iron,What is the primary role of iron in the human body?,5,4,3
4/27/2026 19:36:04,R1777300925002483,Iron,Is iron a metal?,5,4,3
4/27/2026 19:36:05,R1777300925002483,Iron,"Is the specific type of iron (e.g., steel, cast iron, wrought iron) being referred to?",5,5,3
4/27/2026 19:36:05,R1777300925002483,Iron,What is the intended meaning of iron?,4,3,2
4/27/2026 19:36:05,R1777300925002483,Iron,What context is being referred to when discussing iron?,4,4,2
4/27/2026 19:36:05,R1777300925002483,The Secret Garden,Is the Secret Garden a fictional work?,5,4,3
4/27/2026 19:36:05,R1777300925002483,The Secret Garden,"Was the Secret Garden by Frances Hodgson Burnett set in Yorkshire, England?",5,4,3
4/27/2026 19:36:06,R1777300925002483,The Secret Garden,Who is Mary Lennox in the story of The Secret Garden?,5,4,3
4/27/2026 19:36:06,R1777300925002483,The Secret Garden,"What role did Frances Hodgson Burnett play in adapting her novel ""The Secret Garden"" into a stage play?",5,5,4
4/27/2026 19:36:06,R1777300925002483,The Secret Garden,"What is the identity of the main character in ""The Secret Garden""?",5,4,4
4/27/2026 19:36:06,R1777300925002483,Indiana Child Support,Is Indiana a state that requires child support?,5,4,3
4/27/2026 19:36:06,R1777300925002483,Indiana Child Support,Who is responsible for enforcing child support orders in Indiana?,5,4,3
4/27/2026 19:36:06,R1777300925002483,Indiana Child Support,What is the name of the Indiana agency responsible for enforcing child support orders?,5,4,3
4/27/2026 19:36:07,R1777300925002483,Indiana Child Support,"Is this about a specific case or situation involving child support in Indiana, such as a custody dispute or a request for modification?",5,5,4
4/27/2026 19:36:07,R1777300925002483,Arizona Game And Fish,Does Arizona have a department of natural resources?,5,2,2
4/27/2026 19:36:07,R1777300925002483,Arizona Game And Fish,What is the primary purpose of the Arizona Game and Fish Department?,5,4,3
4/27/2026 19:36:07,R1777300925002483,Arizona Game And Fish,What role does Arizona Game and Fish play in managing wildlife populations?,5,4,4
4/27/2026 19:36:07,R1777300925002483,Arizona Game And Fish,Is there a specific type of license or permit required for fishing in Arizona?,5,3,2
4/27/2026 19:36:08,R1777300925002483,Arizona Game And Fish,What notable contribution did Arizona make to the conservation of native wildlife?,5,2,2
4/27/2026 19:36:08,R1777300925002483,Map Of The United States,What is the scale of this map?,5,1,1
4/27/2026 19:36:08,R1777300925002483,Map Of The United States,What geographic region of the United States is typically considered to be part of North America?,5,3,3
4/27/2026 19:36:08,R1777300925002483,Map Of The United States,Is the query about a physical map?,5,2,1
4/27/2026 19:36:08,R1777300925002483,Map Of The United States,Is there a specific region or state within the United States that you would like to see mapped?,5,4,3
4/27/2026 19:36:09,R1777300925002483,Designer Dog Breeds,What is the primary purpose of creating these hybrid breeds?,5,3,2
4/27/2026 19:36:10,R1777300925002483,Designer Dog Breeds,Are designer dog breeds recognized by major kennel clubs?,5,4,3
4/27/2026 19:36:10,R1777300925002483,Designer Dog Breeds,What are some designer dog breeds that originated from specific breed combinations?,5,4,4
4/27/2026 19:36:10,R1777300925002483,Designer Dog Breeds,Are there any specific characteristics or features you'd like me to focus on when discussing designer dog breeds?,5,5,4
4/27/2026 19:36:10,R1777300925002483,Designer Dog Breeds,What careers are typically associated with designer dog breeds?,5,4,3
4/27/2026 19:36:11,R1777300925002483,Neil Young,Was Neil Young primarily associated with the folk rock genre?,5,4,3
4/27/2026 19:36:11,R1777300925002483,Neil Young,What is the intended meaning of Neil Young's music?,5,4,3
4/27/2026 19:36:11,R1777300925002483,Neil Young,Is Neil Young a musician?,5,4,3
4/27/2026 19:36:11,R1777300925002483,Neil Young,What is the intended meaning of neil young?,4,3,2
4/27/2026 19:36:12,R1777300925002483,Neil Young,What is Neil Young's role as an environmental activist?,5,4,3
4/27/2026 19:36:12,R1777300925002483,Gs Pay Rate,What is the pay rate for GS employees?,5,5,4
4/27/2026 19:36:12,R1777300925002483,Gs Pay Rate,Is GS pay rates publicly disclosed?,4,5,3
4/27/2026 19:36:12,R1777300925002483,Gs Pay Rate,Who determines the GS pay rates?,5,4,4
4/27/2026 19:36:12,R1777300925002483,Gs Pay Rate,"Is there a specific industry or job type associated with the ""gs"" pay rate?",4,4,3
4/27/2026 19:36:13,R1777300925002483,Gs Pay Rate,What is the typical GS pay rate for a specific role in the federal government?,5,4,4
4/27/2026 19:36:13,R1777300925002483,Defender,"Is the term ""defender"" referring to a specific type of device or system, such as a computer security software?",5,4,3
4/27/2026 19:36:13,R1777300925002483,Defender,Who is typically considered the primary defender of a country's sovereignty?,4,4,3
4/27/2026 19:36:14,R1777300925002483,Defender,What is the intended meaning of defender?,4,3,2
4/27/2026 19:36:14,R1777300925002483,Defender,Is a defender typically associated with sports?,4,4,3
4/27/2026 19:36:14,R1777300925002483,Map Of Brazil,What is the scale of the map?,5,1,1
4/27/2026 19:36:14,R1777300925002483,Map Of Brazil,What notable geographical features are located in Brazil?,4,2,2
4/27/2026 19:36:14,R1777300925002483,Map Of Brazil,"Is it a specific region within Brazil (e.g. Amazon rainforest, Northeastern states) that you would like to see on the map?",5,5,4
4/27/2026 19:36:14,R1777300925002483,Map Of Brazil,Is Brazil a country?,5,1,1
4/27/2026 19:36:15,R1777300925002483,Map Of Brazil,What is Brazil's geographical location?,5,2,2
4/27/2026 19:36:15,R1777300925002483,Equal Opportunity Employer,Is an equal opportunity employer typically defined by specific geographic location or region?,5,4,3
4/27/2026 19:36:15,R1777300925002483,Equal Opportunity Employer,What is the primary purpose of an equal opportunity employer?,5,4,3
4/27/2026 19:36:15,R1777300925002483,Equal Opportunity Employer,What role or career is being referred to in the context of an equal opportunity employer?,5,4,3
4/27/2026 19:36:15,R1777300925002483,Equal Opportunity Employer,Does an equal opportunity employer actively seek to hire candidates from underrepresented groups?,5,5,4
4/27/2026 19:36:16,R1777300925002483,Who Invented Music,Was the origin of music attributed to a specific culture or civilization?,5,4,4
4/27/2026 19:36:16,R1777300925002483,Who Invented Music,What is the name of the person credited with inventing music?,5,4,4
4/27/2026 19:36:16,R1777300925002483,Who Invented Music,Was there a single inventor of music?,5,4,4
4/27/2026 19:36:17,R1777300925002483,Who Invented Music,Who is credited with being one of the earliest known composers in history?,5,3,4
4/28/2026 11:24:01,R1777302240141788,Porterville,What is Porterville's primary economic industry?,5,5,5
4/28/2026 11:24:01,R1777302240141788,Porterville,Is Porterville a city in California?,5,5,5
4/28/2026 11:24:02,R1777302240141788,Porterville,What is the intended meaning of porterville?,5,4,3
4/28/2026 11:24:02,R1777302240141788,Porterville,"Is Porterville a specific city or location you're referring to, such as in California?",3,5,5
4/28/2026 11:24:03,R1777302240141788,Porterville,What is Porterville known for in terms of its economy or industry?,5,5,5
4/28/2026 11:24:03,R1777302240141788,Rick Warren,What is the intended meaning of rick warren?,5,3,4
4/28/2026 11:24:03,R1777302240141788,Rick Warren,Is Rick Warren's focus on spiritual growth and leadership primarily geared towards Christians or also applicable to other faiths?,5,5,5
4/28/2026 11:24:03,R1777302240141788,Rick Warren,Is Rick Warren a Christian author?,5,5,5
4/28/2026 11:24:04,R1777302240141788,Rick Warren,Who is Rick Warren's primary audience for his books and sermons?,2,4,3
4/28/2026 11:24:04,R1777302240141788,Adobe Indian Houses,"Who were the Adobe Indian people, and what was their traditional way of life?",5,5,5
4/28/2026 11:24:04,R1777302240141788,Adobe Indian Houses,"What specific type of Adobe Indian house are you referring to, such as a Pueblo or Anasazi dwelling?",5,5,5
4/28/2026 11:24:04,R1777302240141788,Adobe Indian Houses,Are Adobe Indian houses typically found in dry desert regions?,5,2,2
4/28/2026 11:24:04,R1777302240141788,Adobe Indian Houses,What role did traditional Indian houses play in the daily lives of their occupants?,5,5,5
4/28/2026 11:24:04,R1777302240141788,Adobe Indian Houses,What type of traditional Indian houses are commonly associated with Adobe construction?,5,3,2
4/28/2026 11:24:04,R1777302240141788,Indexed Annuity,Is an indexed annuity tied to a specific inflation index?,5,4,3
4/28/2026 11:24:05,R1777302240141788,Indexed Annuity,What is the primary benefit of investing in an indexed annuity?,5,5,5
4/28/2026 11:24:05,R1777302240141788,Indexed Annuity,"Is an indexed annuity specifically tied to a particular market index, such as the S&P 500?",5,5,5
4/28/2026 11:24:05,R1777302240141788,Indexed Annuity,What is the intended meaning of indexed annuity?,4,5,5
4/28/2026 11:24:05,R1777302240141788,Bellevue,Is Bellevue a specific city or location?,5,4,5
4/28/2026 11:24:05,R1777302240141788,Bellevue,What is the context in which Bellevue refers to?,5,5,5
4/28/2026 11:24:05,R1777302240141788,Bellevue,What is the intended meaning of bellevue?,4,5,4
4/28/2026 11:24:06,R1777302240141788,Bellevue,Is Bellevue a city?,5,4,4
4/28/2026 11:24:06,R1777302240141788,Bellevue,Is Bellevue referring to the city in Washington state or another location?,5,5,5
4/28/2026 11:24:06,R1777302240141788,Elliptical Trainer,"Is there a specific type of elliptical trainer (e.g. home gym, commercial use, budget range) you are looking for more information on?",5,5,5
4/28/2026 11:24:06,R1777302240141788,Elliptical Trainer,Is an elliptical trainer a type of cardio machine?,5,5,5
4/28/2026 11:24:06,R1777302240141788,Elliptical Trainer,What is the typical target area of an elliptical trainer for users with joint issues?,5,5,5
4/28/2026 11:24:06,R1777302240141788,Elliptical Trainer,What is the intended purpose of an elliptical trainer?,4,5,4
4/28/2026 11:24:07,R1777302240141788,Elliptical Trainer,What is the intended meaning of elliptical trainer?,4,2,2
4/28/2026 11:24:07,R1777302240141788,Alexian Brothers Hospital,What is the role of Alexian Brothers Hospital in providing healthcare services to the community?,4,4,4
4/28/2026 11:24:07,R1777302240141788,Alexian Brothers Hospital,Is Alexian Brothers Hospital a real medical facility?,5,5,5
4/28/2026 11:24:07,R1777302240141788,Alexian Brothers Hospital,What is the primary role or function of Alexian Brothers Hospital in serving its community?,5,5,5
4/28/2026 11:24:07,R1777302240141788,Alexian Brothers Hospital,What notable medical innovation did Alexian Brothers Hospital develop?,4,5,5
4/28/2026 11:24:07,R1777302240141788,Alexian Brothers Hospital,"Is Alexian Brothers Hospital located in Peoria, Illinois?",5,5,5
4/28/2026 11:24:08,R1777302240141788,Dutchess County Tourism,"What is the primary target audience for Dutchess County Tourism, and how do they differ from other regional tourist groups?",4,5,5
4/28/2026 11:24:08,R1777302240141788,Dutchess County Tourism,What nearby attractions are there in Dutchess County that complement its historic sites and natural beauty?,5,5,5
4/28/2026 11:24:08,R1777302240141788,Dutchess County Tourism,Is Dutchess County in New York State?,5,3,3
4/28/2026 11:24:08,R1777302240141788,Dutchess County Tourism,What seasonal events are typically held in Dutchess County?,4,2,2
4/28/2026 11:24:09,R1777302240141788,Dutchess County Tourism,Is Dutchess County a popular tourist destination?,5,4,4
4/28/2026 11:24:09,R1777302240141788,California Franchise Tax Board,Is the California Franchise Tax Board responsible for collecting taxes on businesses operating in California?,4,4,4
4/28/2026 11:24:09,R1777302240141788,California Franchise Tax Board,What is the name of the California state agency responsible for administering the franchise tax?,5,5,5
4/28/2026 11:24:09,R1777302240141788,California Franchise Tax Board,What is the primary role of the California Franchise Tax Board in relation to businesses operating within the state?,4,3,3
4/28/2026 11:24:10,R1777302240141788,California Franchise Tax Board,What role does the California Franchise Tax Board play in enforcing tax laws for businesses operating within the state?,5,5,5
4/28/2026 11:24:11,R1777302240141788,California Franchise Tax Board,"Is the California Franchise Tax Board (FTB) primarily responsible for taxing businesses operating in California, or are there specific industries or types of businesses that may be subject to different tax regulations?",5,5,5
4/28/2026 11:24:11,R1777302240141788,To Be Or Not To Be That Is The Question,"Is this a philosophical inquiry about existentialism, specifically referencing Shakespeare's Hamlet?",3,3,4
4/28/2026 11:24:11,R1777302240141788,To Be Or Not To Be That Is The Question,"What philosophical framework is Hamlet's famous soliloquy ""To be or not to be"" primarily rooted in?",5,5,5
4/28/2026 11:24:11,R1777302240141788,To Be Or Not To Be That Is The Question,Is this a philosophical inquiry?,3,1,1
4/28/2026 11:24:11,R1777302240141788,To Be Or Not To Be That Is The Question,"What is the context in which Shakespeare's famous phrase ""to be or not to be"" appears?",5,5,5
4/28/2026 11:24:11,R1777302240141788,To Be Or Not To Be That Is The Question,Is Hamlet the author of this famous philosophical query?,5,5,5
4/28/2026 11:24:12,R1777302240141788,Texas Border Patrol,"What specific aspect of Texas Border Patrol are you looking for information on, such as their operations, policies, or statistics?",5,5,5
4/28/2026 11:24:12,R1777302240141788,Texas Border Patrol,Is Texas a U.S. state?,5,5,5
4/28/2026 11:24:12,R1777302240141788,Texas Border Patrol,What notable contributions has the Texas Border Patrol made to border security efforts?,4,3,3
4/28/2026 11:24:13,R1777302240141788,Texas Border Patrol,Who is responsible for overseeing the operations of the Texas Border Patrol?,4,2,2
4/28/2026 11:24:13,R1777302240141788,Texas Border Patrol,What role does Texas Border Patrol play in enforcing immigration laws?,5,5,5
4/28/2026 11:24:13,R1777302240141788,Hp Mini 2140,Is the HP Mini 2140 a specific model year or generation that you're looking for information on?,4,3,3
4/28/2026 11:24:13,R1777302240141788,Hp Mini 2140,What is the processor speed of the HP Mini 2140?,5,5,5
4/28/2026 11:24:14,R1777302240141788,Hp Mini 2140,What is the typical price range for a refurbished HP Mini 2140 laptop?,5,5,5
4/28/2026 11:24:14,R1777302240141788,Hp Mini 2140,What is the intended meaning of hp mini 2140?,3,2,2
4/28/2026 11:24:14,R1777302240141788,Hp Mini 2140,Is the HP Mini 2140 a discontinued model?,5,5,5
4/28/2026 11:24:15,R1777302240141788,Espn Sports,What is the current context of ESPN's sports coverage?,4,4,3
4/28/2026 11:24:15,R1777302240141788,Espn Sports,What is the primary role of ESPN in the sports media landscape?,5,5,5
4/28/2026 11:24:16,R1777302240141788,Espn Sports,What is the intended meaning of espn sports?,4,4,4
4/28/2026 11:24:16,R1777302240141788,Espn Sports,Is ESPN primarily a sports network?,5,5,5
4/28/2026 11:24:16,R1777302240141788,Espn Sports,"Is ESPN referring to a specific sport or league, such as NFL, NBA, MLB, or NHL?",5,5,5
4/28/2026 11:24:16,R1777302240141788,Tn Highway Patrol,Who is responsible for enforcing traffic laws along Tennessee highways?,5,5,5
4/28/2026 11:24:16,R1777302240141788,Tn Highway Patrol,What notable contributions has the Tennessee Highway Patrol made to highway safety?,4,3,4
4/28/2026 11:24:16,R1777302240141788,Tn Highway Patrol,What role does the Tennessee Highway Patrol play in enforcing traffic laws?,5,5,5
4/28/2026 11:24:16,R1777302240141788,Tn Highway Patrol,Is the Tennessee Highway Patrol a law enforcement agency?,4,4,4
4/28/2026 11:24:17,R1777302240141788,Tn Highway Patrol,"Is there a specific Tennessee Highway Patrol (THP) unit or division you are referring to, such as the THP's traffic enforcement efforts?",5,5,5
4/28/2026 11:24:17,R1777302240141788,East Ridge High School,What is the location of East Ridge High School?,5,5,5
4/28/2026 11:24:17,R1777302240141788,East Ridge High School,Is East Ridge High School a public school?,5,5,5
4/28/2026 11:24:17,R1777302240141788,East Ridge High School,What is the main purpose or type of East Ridge High School?,3,2,2
4/28/2026 11:24:17,R1777302240141788,East Ridge High School,Is East Ridge High School located in Tennessee?,5,5,5
4/28/2026 11:24:17,R1777302240141788,East Ridge High School,What is the current student body of East Ridge High School?,3,2,2
4/28/2026 11:24:17,R1777302240141788,Atari,What is the intended meaning of atari?,4,5,5
4/28/2026 11:24:18,R1777302240141788,Atari,What is the primary purpose of the Atari brand?,5,5,5
4/28/2026 11:24:18,R1777302240141788,Atari,Was Atari specifically referring to the classic arcade console or the video game company that developed it?,4,3,4
4/28/2026 11:24:18,R1777302240141788,Atari,What was the historical context in which the Atari company emerged?,3,4,3
4/28/2026 11:24:18,R1777302240141788,Atari,Is Atari a well-known video game company?,5,5,5
4/28/2026 11:24:18,R1777302240141788,Ralph Owen Brewster,Was Ralph Owen Brewster an American inventor or engineer?,5,4,4
4/28/2026 11:24:18,R1777302240141788,Ralph Owen Brewster,Is Ralph Owen Brewster a real person?,4,1,1
4/28/2026 11:24:19,R1777302240141788,Ralph Owen Brewster,Who was Ralph Owen Brewster?,5,5,5
4/28/2026 11:24:19,R1777302240141788,Ralph Owen Brewster,What notable scientific contribution did Ralph Owen Brewster make?,5,4,4
4/28/2026 11:24:19,R1777302240141788,Ralph Owen Brewster,What was Ralph Owen Brewster's profession?,5,5,5
4/28/2026 11:24:19,R1777302240141788,Avp,Is AvP a movie?,5,3,3
4/28/2026 11:24:19,R1777302240141788,Avp,"What is the context in which the term ""avp"" is typically used?",5,5,5
4/28/2026 11:24:19,R1777302240141788,Avp,What is the intended meaning of avp?,4,5,5
4/28/2026 11:24:19,R1777302240141788,Avp,"Is the query referring to the 1997 film ""Alien vs. Predator"" or perhaps a different context, such as a video game series?",5,5,5
4/28/2026 11:24:20,R1777302240141788,Avp,What is AvP in the context of video games?,5,4,4
4/28/2026 11:24:20,R1777302240141788,Best Long Term Care Insurance,Who is typically most affected by the high costs of long-term care insurance?,5,5,5
4/28/2026 11:24:20,R1777302240141788,Best Long Term Care Insurance,What type of long-term care insurance plan is best suited for individuals with chronic health conditions?,5,5,5
4/28/2026 11:24:20,R1777302240141788,Best Long Term Care Insurance,"What are the specific features or benefits that you're looking for in a long-term care insurance policy, such as coverage limits, deductibles, or riders?",4,3,4
4/28/2026 11:24:20,R1777302240141788,Best Long Term Care Insurance,Is long-term care insurance typically more expensive for younger individuals?,5,5,5
4/28/2026 11:24:20,R1777302240141788,Volvo,What is the intended meaning of volvo?,4,3,4
4/28/2026 11:24:21,R1777302240141788,Volvo,Who is Volvo's primary target audience for its vehicles?,5,5,5
4/28/2026 11:24:21,R1777302240141788,Volvo,"Is it referring to the Swedish automobile manufacturer or another entity with the name ""Volvo""?",4,2,3
4/28/2026 11:24:21,R1777302240141788,Volvo,Is Volvo a car brand?,5,5,5
4/28/2026 11:24:21,R1777302240141788,Volvo,What is the context in which Volvo is typically associated?,4,2,2
4/28/2026 11:24:22,R1777302240141788,Korean Language,What is the cultural context in which the Korean language originated?,5,5,5
4/28/2026 11:24:22,R1777302240141788,Korean Language,Is there a specific dialect or regional variation of Korean you would like to know more about?,4,5,4
4/28/2026 11:24:22,R1777302240141788,Korean Language,Is Korean a native language of South Korea?,5,5,5
4/28/2026 11:24:22,R1777302240141788,Korean Language,Is Korean a tonal language?,4,2,2
4/28/2026 11:24:23,R1777302240141788,Korean Language,What is the intended meaning of korean language?,2,2,2
4/28/2026 11:24:23,R1777302240141788,Figs,"Are you referring to the fruit, its nutritional benefits, or perhaps a specific variety of fig?",5,5,5
4/28/2026 11:24:23,R1777302240141788,Figs,What are some common health benefits associated with consuming figs?,5,5,5
4/28/2026 11:24:23,R1777302240141788,Figs,What type of figs are you looking for?,4,4,4
4/28/2026 11:24:23,R1777302240141788,Figs,Are figs typically eaten fresh?,4,4,4
4/28/2026 11:24:23,R1777302240141788,Figs,What is the intended meaning of figs?,4,2,2
4/28/2026 11:24:24,R1777302240141788,Ocd,What is the intended meaning of ocd?,4,4,3
4/28/2026 11:24:24,R1777302240141788,Ocd,What is OCD typically characterized by in terms of its symptoms?,4,4,5
4/28/2026 11:24:24,R1777302240141788,Ocd,What is the typical context in which obsessive-compulsive disorder (OCD) is typically diagnosed or discussed?,4,5,4
4/28/2026 11:24:24,R1777302240141788,Ocd,Is OCD typically considered a mental health disorder?,4,3,3
4/28/2026 11:24:24,R1777302240141788,Ocd,Is OCD typically associated with any specific age group or demographic?,4,4,3
4/28/2026 11:24:24,R1777302240141788,Computer Programming,What is the primary context in which computer programming is typically applied?,4,4,4
4/28/2026 11:24:24,R1777302240141788,Computer Programming,Is computer programming a required skill for most jobs?,5,5,5
4/28/2026 11:24:25,R1777302240141788,Computer Programming,What is the intended meaning of computer programming?,4,3,3
4/28/2026 11:24:25,R1777302240141788,Computer Programming,"Is there a specific area of computer programming (e.g. web development, machine learning, game development) that you would like more information on?",5,5,5
4/28/2026 11:24:25,R1777302240141788,Computer Programming,What is the primary role of a compiler in the process of writing code?,4,2,2
4/28/2026 11:24:25,R1777302240141788,Furniture For Small Spaces,"What type of furniture is most suitable for individuals with limited mobility, such as those in small spaces?",5,5,5
4/28/2026 11:24:25,R1777302240141788,Furniture For Small Spaces,"What specific type of furniture are you looking to purchase for your small space, such as compact sofas or foldable tables?",5,5,5
4/28/2026 11:24:26,R1777302240141788,Furniture For Small Spaces,What types of furniture are best suited for narrow hallways or staircases in small apartments?,5,5,5
4/28/2026 11:24:26,R1777302240141788,Furniture For Small Spaces,What type of furniture is best suited for small spaces?,3,4,4
4/28/2026 11:24:26,R1777302240141788,Furniture For Small Spaces,Is budget a consideration when selecting furniture for small spaces?,4,1,1
4/28/2026 11:24:26,R1777302240141788,Starbucks,What is the typical context in which Starbucks operates?,4,4,4
